{
  "schema_version": "2.0",
  "instructions": {
    "purpose": "复杂正式文本的内部工作图，不自动并入正式正文。",
    "use": "填写真实内容；未知内容使用 null；短文本可在内部等价实现。",
    "decision_rule": "根据全文收益决定编辑层级、来源处理程度和主线调整。"
  },
  "document": {
    "title": "",
    "document_type": "",
    "purpose": "",
    "primary_audience": [],
    "core_question": "",
    "target_answer": ""
  },
  "preservation": {
    "author_voice": "",
    "controlled_terms": [],
    "facts_and_numbers": [],
    "citation_identifiers": [],
    "citation_system": "",
    "citation_representation": "",
    "citation_integrity_requirements": [],
    "structures_worth_preserving": [],
    "format_requirements": []
  },
  "mainline": {
    "one_sentence_summary": "",
    "topology": "linear",
    "nodes": [
      {
        "node_id": "M1",
        "judgment": "",
        "function": "",
        "next_node_ids": [],
        "status": "keep"
      }
    ]
  },
  "paragraphs": [
    {
      "paragraph_id": "P1",
      "section": "",
      "current_judgment": "",
      "target_judgment": "",
      "mainline_node_ids": [
        "M1"
      ],
      "reader_enters_knowing": "",
      "reader_leaves_knowing": "",
      "source_ids": [],
      "relation_to_previous": "",
      "relation_to_next": "",
      "edit_level": "paragraph"
    }
  ],
  "sources": [
    {
      "source_id": "E1",
      "source_reference": "",
      "provided_content": "",
      "usable_proposition": "",
      "source_narrative_alignment": "partial",
      "adaptation_action": "light_adapt",
      "target_paragraph_ids": [
        "P1"
      ],
      "argument_task": "explain",
      "entry_proposition": "",
      "inference_gap": "",
      "authored_inference": "",
      "next_proposition": "",
      "mainline_adjustment_needed": "none",
      "mainline_adjustment_reason": "",
      "citation_anchor": "",
      "disposition": "use"
    }
  ],
  "bridges": [
    {
      "bridge_id": "B1",
      "paragraph_id": "P1",
      "from_proposition": "",
      "inference_gap": "",
      "source_ids": [
        "E1"
      ],
      "evidence_contribution": "",
      "authored_inference": "",
      "to_proposition": "",
      "surface_plan": ""
    }
  ],
  "feedback": [
    {
      "feedback_id": "F1",
      "content": "",
      "mainline_node_ids": [
        "M1"
      ],
      "target_paragraph_ids": [
        "P1"
      ],
      "decision": "pending",
      "planned_action": ""
    }
  ],
  "editing_plan": [
    {
      "action_id": "A1",
      "target": "",
      "edit_level": "paragraph",
      "reason": "",
      "preserve": [],
      "change": [],
      "completion_test": []
    }
  ],
  "blockers": [],
  "verification": {
    "core_question_clear": false,
    "target_answer_clear": false,
    "mainline_continuous": false,
    "paragraph_judgments_clear": false,
    "every_used_source_has_argument_task": false,
    "source_adaptation_matches_alignment": false,
    "mainline_adjustments_have_document_gain": false,
    "bridges_complete": false,
    "voice_and_terms_continuous": false,
    "academic_language_concrete": false,
    "facts_numbers_and_citations_preserved": false,
    "no_new_evidence_boundaries_or_defensive_prose": false,
    "no_process_or_feedback_trace": false
  }
}
